87,The Replacements,"'You're not even a has-been; you're a never-was!'' a striking pro football player cracks about Shane Falco (Keanu Reeves), the honorable, stoic fill-in quarterback -- yes, scab -- in ''The Replacements.''

This negligible comedy might as well come with a bouncing ball so members of the audience can recite the dialogue along with the actors. They certainly could do so with Gene Hackman, who plays the honorable, stoic fill-in coach Jimmy McGinty. Mr. Hackman, looking flinty and authoritative in a selection of tweed jackets and hats from the Tom Landry Collection, seems to be repeating lines he used in ''Hoosiers'' and old United Airlines commercials.

''The Replacements'' is so eager to please that it's like a Labrador retriever that slobbers all over you and leaves hair on your favorite sweater. Even the limp, diffident tag line on the poster -- ''Pros on strike. Regular guys get to play!'' -- has an air of desperation. The movie just wants to be loved; is that so wrong? Well, yes, given that ''The Replacements'' is a desperate, broad comedy, full of fist fights, gunplay, projectile vomiting and opposing teams in what looks like the old Oakland Raiders uniforms that made the players look like assassins.

Falco has been making a living cleaning barnacles off boats in the Washington boat basin since he choked at the Sugar Bowl of 1996 -- a year when Ohio State apparently relaxed its age restriction on college players -- and the Buckeyes were slammed in a 40-point loss; he is still coping with the shame.

When the Washington Sentinels go on strike, Falco is recruited by McGinty, who looks at him and intones somberly, ''Nothing counts so much as family. . . .'' Oops, that's one of Mr. Hackman's lines from ''Wyatt Earp.'' He does tell Falco that he has to act like a leader. Mr. Reeves coasts through the picture by keeping his cool, even when he should be ruffled.

''The Longest Yard,'' ''The Dirty Dozen'' and all 30 installments of ''Major League'' are ransacked for ''The Replacements.'' Instead of having a big threatening black man, this movie reinvents the genre by offering several of them: the rapper bodyguard brothers Andre (Michael Taliferro) and Jamal (Faison Love) and Earl Wilkerson (Michael Jace), whose character is as much of a walk-on as he could be, considering that he was released from prison into the custody of a pro team.

There's also the violent Los Angeles cop Bateman (a zealous Jon Favreau) and the Chevy Silverado-size sumo wrestler Jumbo (the large but gentle Ace Yonamine) to crank up the level of comic violence. And it wouldn't be a football picture without a born-again Christian (Troy Winbush). ''

''The Replacements'' also adds a deaf player (David Denman) to the mix. ''He'll never be called offsides on an audible,'' McGinty notes.

Rhys Ifans, who in ''Notting Hill'' was so slight that his chin stubble weighed more than the rest of him, has filled out a bit and plays Nigel Gruff, the immensely talented and garrulous Welsh soccer player used as a place kicker. ''Is he smoking?'' asks John Madden (playing himself in the announcer booth, along with Pat Summerall), noting the cigarette dangling from Nigel's mouth under the helmet.

The movie has no pretensions, but it louses up a great subject. The 1987 N.F.L. Players Union strike, on which it is based, gave fans a chance to see some of the most unusual football ever; it was like watching the cable access version of the World Football League, with a palpable current of players' desire keeping the undertalented on the field. There is probably still a movie to be made about that strike over free agency.

Since Los Angeles is such a union town and there is talk of possible Screen Actors Guild and Writers' Guild strikes in the next year, it's odd to see a movie that essentially glorifies scabs (especially at a time when athletes like Tiger Woods are being attacked for crossing picket lines to do commercials during the actors' strike against ad companies).

During the 1987 strike, the fans kept coming out to watch the games, turning the stadium parking lots into huge tailgate rallies. The play-by-play guys shook their heads and did their jobs. In the movie, Mr. Madden and Mr. Summerall are probably supposed to offer the same kind of comic relief that ''Major League'' got from Bob Uecker -- who's better at using baseball for stand-up than he did as a player? -- but their lack of comment on the politics of the strike seems peculiar, too. The real-life players lost their job action, and the sight of big-ticket players crossing the picket lines opened a wound of bitterness that took years to heal; some say it never did.

''The Replacements'' cheapens all this by treating the striking pros as spoiled princes. Interviewed by a news crew, a player looks into the camera and says, ''You have any idea what insurance on a Ferrari costs?'' And McGinty grumbles to the team's owner (Jack Warden): ''You don't have any players. They all flew off to their private castles.''

The closest the picture gets to the kind of guy who ended up on the field during the strike is the wide receiver Clifford Franklin (Orlando Jones), a viper-fast sprinter who can't hold onto the ball. When Franklin gets to see his pro football player heroes up close, they're flinging eggs at the bus in which he and the other scabs are traveling. He's wide-eyed, terrified and happy.

A lot of the work is done by the foot-stomper old-school stadium rock songs heard at every pro sports event -- Queen's ''We Will Rock You,'' for example. The soundtrack, which sounds as if K-Tel put it together, includes ''Unbelievable'' and ''I Will Survive,'' which is fast emerging as this summer's movie anthem. (If you close your eyes, you could be at ''Coyote Ugly.'') Franklin adopts it as the team's theme and leads his teammates through the Electric Slide when they're behind bars after a fight with the striking players.

''Better lucky than good,'' Falco says at one point. With its feel-good exuberance, it will probably win an audience. After all, an ugly win is still a win. 
''The Replacements'' is rated PG-13 (Parents strongly cautioned). It includes profanity, alcohol consumption and knockabout football violence. 

THE REPLACEMENTS 

Directed by Howard Deutch; written by Vince McKewin; director of photography, Tak Fujimoto; edited by Bud Smith and Seth Flaum; music by John Debney; production designer, Dan Bishop; produced by Dylan Sellers; released by Warner Brothers. Running time: 105 minutes. This film is rated PG-13. 

WITH: Keanu Reeves (Shane Falco), Gene Hackman (Jimmy McGinty), Orlando Jones (Clifford Franklin), Jon Favreau (Daniel Bateman), Brooke Langton (Annabelle Farrell), Rhys Ifans (Nigel Gruff), Michael Taliferro (Andre Jackson), Faison Love (Jamal Jackson), Michael Jace (Earl Wilkerson), Ace Yonamine (Jumbo Fumiko), Troy Winbush (Walter Cochran), David Denman (Brian Murphy) Jack Warden (Edward O'Neil), and John Madden and Pat Summerall as themselves. "
92,RescueDawn,"The Navy airman Dieter Dengler (Christian Bale), the hero of Werner Herzogís Vietnam-era P.O.W. escape film, ìRescue Dawn,î at first seems a conventional action-movie hero: handsome, resourceful, brave and optimistic. But the more time spent with him, the more eccentricities he reveals. He has a geeky laugh. His sunny-side-up speechifying suggests an elementary school gym coach with a Vince Lombardi fixation. He only seems typical.
More About This Movie
Rescue Dawn

Werner Herzog Is Still Breaking the Rules (July 1, 2007)
So does Mr. Herzogís movie, which reimagines his 1997 documentary, ìLittle Dieter Needs to Fly,î as a drama of imprisonment, survival and perseverance. Although financed independently, it superficially resembles the likes of ìPapillonî and ìThe Great Escape.î With its straightforward narrative, which observes Dengler being shot down during his first mission over Laos; surviving torture, isolation, confinement and starvation; and hatching a daring breakout, ìRescue Dawnî seems a departure from Mr. Herzogís ìAguirre, The Wrath of God,î ìFitzcarraldo,î ìGrizzly Manî and other cautionary tales of visionary madmen.

Dengler is also an advertisement for capitalist democracy: a German immigrant who survived Allied bombing during World War II, settled in the United States and became a baseball-and-apple-pie American. In early shipboard scenes, the filmís cinematographer, Peter Zeitlinger, lights Mr. Bale like Tom Cruise in ìTop Gun,î and Mr. Baleís gung-ho grin seals the comparison.

When Denglerís captors demand that he sign a confession declaring himself a criminal, Dengler refuses, because to do so would be ungrateful to his adoptive country. Heís as matter-of-fact as a diabetic declining a chocolate bar. Yet these indicators of superheroism exist to be subverted. Dengler endures misery without succumbing to the despair that has crushed his cellmates, but he starts to seem as unhinged as Mr. Herzogís Aguirre and Fitzcarraldo. Under these conditions, hope is a form of insanity.

Dengler is just one oddball among many. His comrades include best friend and mentor, Duane (the great Steve Zahn, whose ravaged face recalls Steve McQueenís in ìPapillonî), and ìGene from Eugeneî (Jeremy Davies, in a boldly stylized, sure-to-be-divisive performance), a longhaired, emaciated redneck whose cadences and gestures suggest a deranged skid row preacher.

In the past, Mr. Herzog has been criticized for his tendency to treat residents of the third world as part of the scenery, but in ìRescue Dawnî he has empathy for Denglerís captors. They are prisoners, too. Theyíre vicious because theyíre bored and depressed, but they occasionally display kindness. When they consider executing the prisoners and abandoning the camp, Mr. Herzog makes it clear that this potential course of action is not evidence of subhuman evil, but a desperate plan hatched by men who donít have enough food to feed themselves and their inmates and would rather just go home to their families. As Duane explains to Dengler, ìThe jungle is the prison ó donít you get it?î

The film is not without flaws. The storyís basis in fact doesnít inoculate it against charges of predictability. Klaus Badeltís score can be intrusively emphatic. And the triumphant ending ó in which Dengler is welcomed back to his carrier with applause and speeches ó is disappointingly conventional. For the most part, though, ìRescue Dawnî is a marvel: a satisfying genre picture that challenges the viewerís expectations.

The filmís most daring aspect is its portrait of the love that blossoms between men in bleak circumstances. While platonic, Dengler and Duaneís relationship has the depth and detail of a great marriage ó one in which the spouses understand each other so well that they can have a silent conversation with their eyes. Denglerís commitment to helping Duane escape ó despite choking vines, whizzing bullets, pounding rain and leech-infested waters ó is as reflexive as the integrity he displays when he refuses to sign that confession. As Dengler literally and figuratively lets Duane lean on him, the filmís tenderness goes so far beyond male-bonding clichÈ that it becomes a political statement: a radical reimagining of the phrase ìdoing what a manís gotta doî that rejects John Wayne as a masculine ideal and replaces him with Jesus.

ìRescue Dawnî is rated PG-13 (Parents strongly cautioned). It has profanity, graphic violence, torture and assorted jungle miseries.

RESCUE DAWN

Opens today in Manhattan.

Written and directed by Werner Herzog; director of photography, Peter Zeitlinger; edited by Joe Bini; music by Klaus Badelt; produced by Steve Marlton, Elton Brand and Harry Knapp; released by Metro Goldwyn Mayer. Running time: 120 minutes.

WITH: Christian Bale (Dieter Dengler), Steve Zahn (Duane) and Jeremy Davies (Gene).
Correction: July 12, 2007


A film review on July 4 about ìRescue Dawn,î written and directed by Werner Herzog, misspelled the title of another Herzog film with which ìRescue Dawnî was contrasted. It is ìFitzcarraldo,î not ìFizcarraldo.î"
95,The Birdcage,"Shaking a layer of dust off its well-worn marabou, ""La Cage aux Folles"" returns to the screen as ""The Birdcage,"" an American remake with plenty of new pizazz. This material still shows its age (as it did even in the 1979 French-language version), but it has been tarted up with giddy ingenuity.

Staged by Mike Nichols in a tame, AIDS-free universe where homosexuality simply means wacky fashion sense, it now features political satire, Robin Williams in a devilishly debonair mode, Nathan Lane in outlandish drag and plenty of dialogue in the irresistible voice of Elaine May. When a reporter from The National Enquirer starts pestering these characters, one of them has this to say about the news hound: ""My God, he's put on so much weight since the Simpson trial!""

The French film, based on the stage play by Jean Poiret, obviously didn't have that. But to an astonishing degree, ""The Birdcage"" amounts to a line-by-line copy, though Ms. May often takes the original punch line and adds significantly more punch. For instance, when the story's transvestite character has a tantrum and refuses to perform at the drag nightclub of the title, he's told in the French film that there's a large crowd waiting for him to go on. New version, set in South Beach in Miami instead of St. Tropez: ""There's 150 people out there, half of them are Kennedys, and they're all waiting for you!""

The plot, as dizzyingly farcical as ever: Armand (Mr. Williams) and Albert (Mr. Lane) are a gay couple who have together raised Armand's son, Val (Dan Futterman). Now, to their chagrin, Val wants to get married. And to a girl -- and a girl (Calista Flockhart) whose father is a prominent conservative politician. The film makers have had great fun turning the father, played with deadpan wickedness by Gene Hackman, into a buffoonish Pat Buchanan who frets over which clergyman should marry Val and his daughter. The Pope? ""Too controversial."" Billy Graham? ""Too liberal.""

The film revolves around a single event, the meeting of these colossally incompatible future in-laws. Senator Keeley and his snobbish wife (Dianne Wiest plays her hilariously, wondering if South Beach is anything like Palm Beach) are hoping that Val's family will be highly respectable, since they're trapped in the midst of a nasty political scandal. Armand and Albert, for their part, want to do Val a favor by temporarily straightening up their act. That means purging their apartment of homoerotic bric-a-brac and bringing in new props, like a nice set of books. When Mrs. Keeley takes a good look at them, she wonders why they're Nancy Drew.

Meanwhile, Armand gives Albert the obligatory lessons in he-manly behavior. And Albert, who minces extravagantly, is even taught how to walk like John Wayne. (Where the French film accepted the Wayne stride as a masculine ideal, this new version finds it interestingly peculiar.) Mr. Nichols puts his film through these paces with dependable comic agility, and rises to the requisite frantic pitch when the two families meet for dinner. Regrettably, Armand and Albert's wildly campy houseboy (Hank Azaria) has set out the pornographic china. ""Why, it looks like young men playing leapfrog!"" sweetly exclaims Mrs. Keeley. ""Is it Greek?""

""The Birdcage"" augments such mock-naughty gags with topical references to abortion, gays in the military (Alexander the Great is mentioned) and some sneaky jabs at Senator Keeley's anti-Semitism. It even presents gay characters who think Bob Dole is cute. But it still has little footing in the real world. The gay nightclub setting is watered down with shots of a heterosexual audience, and Armand and Albert seem even less like actual lovers than their French predecessors did. The subplot involving the biological mother (played by Christine Baranski) who abandoned Val has gone from farfetched to vaguely appalling. When the farce isn't fizzing, these characters look several shades more dimwitted than they did before.

""The Birdcage"" might seem an odd occasion to find Mr. Williams playing things straight, but this is one of his most cohesive and least antic performances. It's also a mischievously funny one: he does a fine job of integrating gag lines with semi-serious acting, all the while modeling a delirious, silky wardrobe with the emphasis on nightmare prints. Mr. Lane, in the campier role, gives a solid but broad performance without the coy gentility that made Michel Serrault funnier in French. But he has nice legs and looks good in pearls.

""The Birdcage"" is rated R (Under 17 requires accompanying parent or adult guardian). It includes mild profanity and sexual references.

THE BIRDCAGE

Produced and directed by Mike Nichols; written by Elaine May, based on the stage play ""La Cage aux Folles"" by Jean Poiret, and the screenplay by Francis Veber, Edouard Molinaro, Marcello Danon and Mr. Poiret; director of photography, Emmanuel Lubezki; edited by Arthur Schmidt; music by Jonathan Tunick; production designer, Bo Welch; released by United Artists. Running time: 117 minutes. This film is rated R.

WITH: Robin Williams (Armand), Gene Hackman (Senator Keeley), Nathan Lane (Albert), Dianne Wiest (Louise Keeley), Christine Baranski (Katharine), Dan Futterman (Val) and Calista Flockhart (Barbara)."
97,Unforgiven,"TIME has been good to Clint Eastwood. If possible, he looks even taller, leaner and more mysteriously possessed than he did in Sergio Leone's seminal ""Fistful of Dollars"" a quarter of a century ago. The years haven't softened him. They have given him the presence of some fierce force of nature, which may be why the landscapes of the mythic, late 19th-century West become him, never more so than in his new ""Unforgiven.""

As written by David Webb Peoples and directed by Mr. Eastwood, ""Unforgiven"" is a most entertaining western that pays homage to the great tradition of movie westerns while surreptitiously expressing a certain amount of skepticism. Mr. Eastwood has learned a lot from his mentors, including the great Don Siegel (""Two Mules for Sister Sara"" and ""The Beguiled,"" among others), a director with no patience for sentimentality.

The time is the 1880's. The principal setting is Big Whiskey, a forlorn hamlet in that vast American no-man's land of high plains edged by mountains, somewhere between St. Louis and San Francisco but not on any map.

Late one night a couple of cowboys are on the second floor of the saloon with the girls. Suddenly one of the cowboys whips out his knife and slashes the face of Delilah, the prostitute he's with. It seems that she made a rude comment about his anatomy. Instead of arresting the cowboys, Little Bill Daggett, the sheriff, allows them to get off with the understanding that they hand over six horses to the saloon keeper.

Strawberry Alice, the victim's best friend, is outraged. ""We may be whores,"" she says, ""but we aren't horses."" Alice, Delilah and the other girls pool their savings and offer a bounty of $1,000 to anybody who will murder the cowboys.

Thus ""Unforgiven"" becomes an epic about the revenge of whores. It's not sending up the women. Rather it's equating Old Western codes of honor with the handful of men who set out to collect the bounty, motivated in varying degrees by economic necessity, greed and half-baked notions of glory.

Chief among the bounty hunters is the aging Bill Munny (Mr. Eastwood), a widower trying to support his two young children on an unsuccessful hog farm. Munny has been keeping to himself in recent years. He's still trying to live down his notorious career as a gun-crazy outlaw, a man who used to shoot women, children -- anybody -- just for the hell of it.

There is something creepy about him now, especially about the way he keeps harping on how his wife ""saved"" him, his distaste for violence and his need to be true to his pledge never to pick up a gun again. He has something of the manner of the mild-mannered clerk who comes into the office on Monday morning and shoots everyone in sight.

When a young fellow who styles himself the Schofield Kid (Jaimz Woolvett) asks Munny to join him to win the bounty, Munny at first refuses. Then he changes his mind, apparently because he is desperately hard up, but with Munny you can't be sure. Along the way to Big Whiskey, they are joined by Ned Logan (Morgan Freeman), who rode with Munny in the outlaw days and appears to trust him.

Also en route to Big Whiskey for the same purpose is English Bob (Richard Harris). He's a dandyish former outlaw who, when first seen, is aboard a train, reading about the assassination of President James A. Garfield and explaining to anyone who will listen why America would be better off with a king. His admiring companion is W. W. Beauchamp (Saul Rubinek), whom English Bob introduces as ""my biographer,"" the author of a penny dreadful about the outlaw titled ""The Duke of Death.""

Little Bill Daggett (Gene Hackman) is ready for the bounty hunters as they arrive in Big Whiskey. He immediately spots English Bob as he gets off the stagecoach, gives him a sadistic beating and throws him in jail. Mr. Harris, who has a tendency to overpower his roles, has never been finer, funnier or more restrained than he is as English Bob, whom Daggett insists on calling ""the Duck of Death.""

Things turn far darker with the arrival of Munny, Ned and the Schofield Kid. Daggett suspects their purpose but is unable to prove anything. Just to let them know who runs Big Whiskey, Daggett beats up Munny as savagely as he has English Bob, but Munny appears to ask for it. Bleeding and only partly conscious, he crawls out of the saloon and into a muddy gutter.

It is a measure of how the film works that Munny's almost Christ-like acceptance of his beating is one of the film's scariest moments. There is a madness inside him waiting to emerge, but where and when? ""Unforgiven,"" which has no relation to ""The Unforgiven,"" the 1960 John Huston western, never quite fulfills the expectations it so carefully sets up. It doesn't exactly deny them, but the bloody confrontations that end the film appear to be purposely muted, more effective theoretically than dramatically.

This, I suspect, is a calculated risk. Mr. Eastwood doesn't play it safe as a director, but there are times in ""Unforgiven,"" as in his jazz epic, ""Bird,"" that the sheer scope of the narrative seems to overwhelm him. It's not easy cramming so much information into a comparatively limited amount of time. Toward the end of ""Bird,"" he didn't seem to be telling the story of Charlie Parker as much as letting it unravel. That doesn't happen in ""Unforgiven,"" but the tone, so self-assured to begin with, becomes loaded with qualifications.

The film looks great, full of broad chilly landscapes and skies that are sometimes as heavy with portents as those in something by El Greco. It's corny but it works.

Photographed by Jack N. Green, who was the camera operator for Bruce Surtees, Mr. Eastwood's cinematographer for ""Pale Rider,"" ""Unforgiven"" favors the kind of backlighting that can add a sense of desolation and menace to even the most conventional moments. Seen against a bright background, faces turned to the camera are so hidden in shadow that they aren't immediately recognizable. It is a storyteller's gesture for the audience's benefit, since the other characters within the scene would not be so disadvantaged.

The cast is splendid, though some of the actors have more to do than others, including Mr. Freeman, whose role is not especially demanding. Mr. Hackman delights as Sheriff Daggett: no more Mr. Good Guy. Also worthy of particular note are Mr. Woolvett, who makes his feature film debut as the unreliable Schofield Kid; Mr. Rubinek as a city journalist out of his element out West, and Frances Fisher as Strawberry Alice, a woman who doesn't know when to shut up.

Yet the center of attention, from the moment he rises up out of a hog pen until the darkest fade-out in western movie history, is Mr. Eastwood. This is his richest, most satisfying performance since the underrated, politically lunatic ""Heartbreak Ridge."" There's no one like him.

""Unforgiven"" is rated R (Under 17 requires accompanying parent or adult guardian). It has a lot of violence, vulgar language and some sexual situations. Unforgiven Directed and produced by Clint Eastwood; written by David Webb Peoples; director of photography, Jack N. Green; edited by Joel Cox; music by Lennie Niehaus; production designer, Henry Bumstead; released by Warner Brothers. Running time: 130 minutes. This film is rated R. Bill Munny . . . Clint Eastwood Little Bill Daggett . . . Gene Hackman Ned Logan . . . Morgan Freeman English Bob . . . Richard Harris Schofield Kid . . . Jaimz Woolvett W. W. Beauchamp . . . Saul Rubinek Strawberry Alice . . . Frances Fisher Delilah Fitzgerald . . . Anna Thomson Quick Mike . . . David Mucci Davey Bunting . . . Rob Campbell Skinny Dubois . . . Anthony James Little Sue . . . Tara Dawn Frederick Silky . . . Beverley Elliott Faith . . . Liisa Repo-Martell Crow Creek Kate . . . Josie Smith Will Munny . . . Shane Meier Penny Munny . . . Aline Levasseur"
