0,The Matrix,"Action heroes speak volumes about the couch-potato audiences that they thrill. So it's understandable that ''The Matrix,'' a furious special-effects tornado directed by the imaginative brothers Andy and Larry Wachowski (''Bound''), couldn't care less about the spies, cowboys and Rambos of times gone by. Aiming their film squarely at a generation bred on comics and computers, the Wachowskis stylishly envision the ultimate in cyberescapism, creating a movie that captures the duality of life a la laptop. Though the wildest exploits befall this film's sleek hero, most of its reality is so virtual that characters spend long spells of time lying stock still with their eyes closed.

In a film that's as likely to transfix fans of computer gamesmanship as to baffle anyone with quaintly humanistic notions of life on earth, the Wachowskis have synthesized a savvy visual vocabulary (thanks especially to Bill Pope's inspired techno-cinematography), a wild hodgepodge of classical references (from the biblical to Lewis Carroll) and a situation that calls for a lot of explaining.

The most salient things any prospective viewer need know is that Keanu Reeves makes a strikingly chic Prada model of an action hero, that the martial arts dynamics are phenomenal (thanks to Peter Pan-type wires for flying and inventive slow-motion tricks), and that anyone bored with the notably pretentious plotting can keep busy toting up this film's debts to other futuristic science fiction. Neat tricks here echo ''Terminator'' and ''Alien'' films, ''The X-Files,'' ''Men in Black'' and ''Strange Days,'' with a strong whiff of ''2001: A Space Odyssey'' in the battle royale being waged between man and computer. Nonetheless whatever recycling the brothers do here is canny enough to give ''The Matrix'' a strong identity of its own.

Mr. Reeves plays a late-20th-century computer hacker whose terminal begins telling him one fateful day that he may have some sort of messianic function in deciding the fate of the world. And what that function may be is so complicated that it takes the film the better part of an hour to explain. Dubbed Neo (in a film whose similarly portentous character names include Morpheus and Trinity, with a time-traveling vehicle called Nebuchadnezzar), the hacker is gradually made to understand that everything he imagines to be real is actually the handiwork of 21st-century computers. These computers have subverted human beings into batterylike energy sources confined to pods, and they can be stopped only by a savior modestly known as the One.

We know even before Neo does that his role in saving the human race will be a biggie. (But on the evidence of Mr. Reeves's beautiful, equally androgynous co-star, Carrie-Anne Moss in Helmut Newton cat-woman mode, propagating in the future looks to be all business.) The film happily leads him through varying states of awareness, much of it explained by Laurence Fishburne in the film's philosophical-mentor role. Mr. Fishburne's Morpheus does what he can to explain how the villain of a film can be ''a neural interactive simulation'' and that the Matrix is everywhere, enforced by sinister morphing figures in suits and sunglasses. ''The Matrix'' is the kind of film in which sunglasses are an integral part of sleekly staged fight scenes.

With enough visual bravado to sustain a steady element of surprise (even when the film's most important Oracle turns out to be a grandmotherly type who bakes cookies and has magnets on her refrigerator), ''The Matrix'' makes particular virtues out of eerily inhuman lighting effects, lightning-fast virtual scene changes (as when Neo wishes for guns and thousands of them suddenly appear) and the martial arts stunts that are its single strongest selling point. As supervised by Yuen Wo Ping, these airborne sequences bring Hong Kong action style home to audiences in a mainstream American adventure with big prospects as a cult classic and with the future very much in mind.

''The Matrix'' is rated R (Under 17 requires accompanying parent or adult guardian). It includes strange, unreal forms of violence and occasional gore. THE MATRIX 

Written and directed by the Wachowski Brothers; director of photography, Bill Pope; edited by Zach Staenberg; music by Don Davis; production designer, Owen Paterson; produced by Joel Silver; released by Warner Brothers. Running time: 115 minutes. This film is rated R. 

WITH: Keanu Reeves (Neo), Laurence Fishburne (Morpheus), Carrie-Anne Moss (Trinity), Hugo Weaving (Agent Smith) and Joe Pantoliano (Cypher). "
9,The Matrix Reloaded,"'I wish I knew what I was supposed to do,'' Neo (Keanu Reeves) says early in ''The Matrix Reloaded'' after a violent, apparently premonitory dream. Of course he does know what to do: he's ''the One,'' as murmured in the mellifluous, currant-scented voice of his mentor, Morpheus (the righteous Laurence Fishburne).

Neo is wondering about his place as cynosure of the new world, trapped under the burden of knowing he's expected to lead the way. And the weight of a similar worry rests on the shoulders of ''Reloaded.'' Relax, the staging of the action sequences is as viciously elegant as you've been primed to expect, though there is a dispiriting more-of-the-same aspect to the picture.

It has been four years since the release of ''The Matrix,'' the first part of the planned action-metaphorical melodrama trilogy. This second installment, which opens nationwide tomorrow, is a blend of Hong Kong action, comic books, anime, philosophy and the New Testament and has the feel of a holding pattern.

But the mastery of filmmaking hasn't abated in ''Reloaded.'' The writing and directing tandem of Larry and Andy Wachowski are as suited to the task of guiding this film as Neo is to saving the world from the onslaught of the Sentinels, computer emissaries bent on eliminating all vestiges of humanity. Their relentless love of movies, junk-food mythology and thoughtful reimagining of a future endangered by mass consumption and proliferation of pleasure to the point of soullessness makes for a heady and unusual mix.

The directors pay their audiences the unlikely compliment of taking them seriously. Unfortunately they take themselves too seriously. What the first ''Matrix'' had going for it was surprise, a freshness that would be impossible to match. The hot-blooded tumble of energy and concepts wrestling for primacy was viscerally and intellectually arousing; everybody had something to take home.

''Reloaded'' seeks to increase the emotional stakes -- which it doesn't quite accomplish -- while leaving enough of a cliffhanger that audiences will be bedeviled enough to flock back into the tents for the last portion. Hilariously, the directors make their points about the corrupting power of images in an idealized context of movie action heroes so beautifully that designers are aping the sleek, tailored frock coats and dusters that the heroes don to combat evil in what is essentially a dream world. In the human world they live in disintegrating attire that wouldn't look out of place on Phish roadies. The dream merchants are missing the philosophical point of the picture, which takes on added significance with some of the cameos.

Neo and his lover, Trinity (Carrie-Anne Moss) are so fit that they seem like virtual humans; they're burned down to true grit; there even seems to be distended vascularity flexing in their sculptured eyebrows. They need to be in shape, since they battle new foes including platinum-dreadlocked apparitions (played by Neil and Adrian Rayment).

In ''The Matrix'' Neo was awakened to his abilities and destiny to combat the forces of virtual oppression. ''Reloaded'' takes us deep into Zion, the heart of the human world that Neo, Morpheus, Trinity and a new team member, Link (Harold Perrineau), have been fighting to protect from the computers that are trying to wipe out homo sapiens.

They're worn, returning heroes, though many in Zion -- including Morpheus's rival, Commander Lock (Harry Lennix) -- are skeptical of their ideals. Morpheus's belief that victory is at hand, which leads to a worldwide celebration that looks like a rave taking place on Planet Groove, doesn't sit well with the pragmatic Lock at all; he has no faith in Neo or Morpheus.

Lock's envy is amplified by Morpheus's past romantic ties to the all-business warrior-girl Niobe (Jada Pinkett Smith), who seems to have emerged from the Mary J. Blige school of directness: she telegraphs what she's thinking before she opens her mouth. Outside Zion, 250,000 Sentinels stand by. In addition to that threat Agent Smith, who seemed to have been destroyed in the first film, is now a free-floating renegade who can multiply at will, a copy without an original. He's again played by the capable Hugo Weaving, who brings an exultant beatitude to laminated malignancy.

A rueful hero, sodden by the demands of his role, is the subtext of ''Reloaded.'' Neo is beset by eager devotees, and Mr. Reeves's mildly shell-shocked blankness -- he's haunted by aspirations -- is the complement to the adoring throngs, who don't bother to notice his discomfort.

The Wachowskis want to heighten the narrative and philosophical import hinted at in the first film, assuming, probably rightly, that audiences want more to digest than digitally abetted mano a mano climaxes. ''Reloaded'' sounds like the right word: half the picture seems to be about uploading the explication of mythology, which takes on a doleful self-importance. These repercussions are intoned in stentorian, buttercream tones by Morpheus; no wonder Neo is so depressed.

''Reloaded'' is also an apt word because much of the tenor of the action is repeated. The martial arts sequences are breathtakingly staged; the 15-minute chase sequence on an multilane highway is alone worth sitting through the picture.

More than its predecessor, ''Reloaded'' is about the virtues of the industrial world versus the dangers of new technology: old-fashioned phones with rotary dials still figure in this world. And an important component in helping to fight the Sentinels, the Keymaker (Randall Duk Kim), actually carries around old-fashioned master keys and works his magic on grimy, metal tumblers instead of virtual pathways.

The Wachowskis' use of space rivals that of musical directors like Gene Kelly and Mark Sandrich. The battles seem a bit repetitive, though, it's as if no one is sure to what to do with Neo's powers. More important, ''Reloaded'' has one of the most excitingly subversive and radical points of view ever seen in a major motion picture: a postmodern purview that accords equal weight to philosophical ideals from people of color. One example is the warmhearted spotlight on Gloria Foster, who returns as the grande dame Oracle, the source of all knowledge for Neo. And few actresses have ever been as luminously photographed as Ms. Pinkett Smith. Even Mr. Reeves's pan-Asian exoticism lends itself to this ideal of the future. 
''Matrix'' Reloaded'' is rated R (Under 17 requires accompanying parent or adult guardian) for strong language and languorous, extended bouts of the slow-motion, meticulously staged violence that has fans trembling with excitement. 

THE MATRIX RELOADED 

Written and directed by the Wachowski Brothers; director of photography, Bill Pope; edited by Zach Staenberg; music by Don Davis; production designer, Owen Paterson; visual effects supervisor, John Gaeta; produced by Joel Silver; released by Warner Brothers Pictures. Running time: 138 minutes. This film is rated R. 

WITH: Keanu Reeves (Neo), Laurence Fishburne (Morpheus), Carrie-Anne Moss (Trinity), Hugo Weaving (Agent Smith), Jada Pinkett Smith (Niobe), Gloria Foster (the Oracle), Monica Bellucci (Persephone), Nona Gay (Zee), Randall Duk Kim (Keymaker), Harry Lennix (Commander Lock), Harold Perrineau (Link), Adrian Rayment (Twin No. 2) and Neil Rayment (Twin No. 1). "
10,The Matrix Revolutions,"'Everything that has a beginning has an end.'' This sentence appears on the front page of the production notes handed out at press screenings of ''The Matrix Revolutions,'' which opens worldwide today. It is also uttered by the Oracle (Mary Alice) in response to a question from Neo (Keanu Reeves). ''Where is this going?'' he wants to know. ''Where will it end?'' Neo may be the One, but he can hardly be the only One posing such questions. The talk of endings in this, the third and ostensibly final movie in the series, is so insistent that you may wonder whether the Wachowski brothers, who wrote and directed it, felt the need to reassure the audience, and perhaps themselves, that it was really, finally over. There are still a few loose ends that might be spun into future sequels -- ''The Matrix Recycled,'' perhaps, or ''The Matrix Recall Election'' or ''The Matrix Recipe Book and Holiday Menu Planner'' (featuring the Oracle's baking tips) -- but the saga of Neo, which began in 1999 when he was a scruffy hacker who took a red pill, has now by all appearances reached its terminus. The appropriate response is somewhere between ''About time'' (about six hours, depending on what's added for the DVD release) and ''So what?''

Still it would be unfair to the Wachowskis, special-effects virtuosos that they are, to say that their trilogy ends with a whimper. There is plenty of bright light and big noise in ''Revolutions'' -- a ferocious machine assault on battered Zion, a rain-swept showdown between Neo and his nemesis Smith (Hugo Weaving), a giant talking Wizard of Oz head. Some major characters meet gruesome deaths, while others endure heroically. But all this bombast, which may raise an honest goose bump or two, cannot dispel the overall atmosphere of exhaustion.

The first ''Matrix'' succeeded by entwining traditional -- and often breathtakingly innovative -- action-movie motifs with the mapping of an intricate and mysterious world. The Wachowskis were pioneers in bringing some of the exploratory fascination of advanced video games into the movies, and ''The Matrix'' was so absorbing because the viewer's initial disorientation and gradual enlightenment followed Neo's own initiation into the film's vividly imagined layers of reality and meaning. All of which have, perhaps inevitably, flattened out.

Once the game environment has been surveyed, there is nothing to do but play, which is never as enthralling, especially when the keyboard or the joystick is in someone else's hands. ''The Matrix Reloaded,'' which has become the highest-grossing movie of 2003 in spite of widespread disappointment among critics and fans alike, tried to extend the first film's elegant mixing of action and exposition, only to bog down hopelessly in portentousness and obfuscation.

''Reloaded'' was certainly a lumpy, gaseous treatise of a movie, but viewers of ''Revolutions'' may find themselves looking back on it fondly. It was at least overstuffed with potentially interesting new characters, plot lines and make-believe metaphysical conundrums. In contrast ''Revolutions,'' which has a roughly equivalent running time, feels padded. The battle for Zion goes on forever and seems designed to justify the picture's enormous military hardware budget. There is very little that is tantalizing or suspenseful. The feeling of revelation is gone, and many of the teasing implications of ''Reloaded'' have been abandoned.

Persephone and the Merovingian, the sinister computer-program power couple played by Monica Bellucci and Lambert Wilson, return only briefly, forcing countless budding Matrix scholars to toss out whole chapters of their dissertations and cheating those of us who counted on a little more old-style movie star voluptuousness to warm up the virtual chill.

Mr. Reeves, perhaps worried that he was showing too much range, has purged himself of all expression apart from a worried frown and a sorrowful grimace. The salient distinction of the human remnant in Zion, apart from their earth-tone natural-fiber fashions, has been the capacity for love, a word much spoken in this movie. But their ranks, in spite of the presence of fine actors like Laurence Fishburne, Harry Lennix and Harold Perrineau, become more robotic with every passing scene. The sole exception is Jada Pinkett Smith as the daredevil pilot Niobe, who brings a touch of bad-girl B-movie attitude into the humorless subterranean gloom.

The major disclosure of ''Revolutions'' is that the boundaries that had previously separated the real world from the Matrix, and the humans from the programs, have proven to be porous. Smith has jumped out of the Matrix, and Neo is able to export his special powers from that realm into the machine-controlled physical domain. It turns out that there is train service connecting the various worlds, though its only customers are two Indian computer programs who have apparently given birth to a human child, a lovely little girl named Sati. All of this may be puzzling -- I was puzzled, anyway -- but scenes like the one in which Neo meets Sati and her parents have a quiet, beguiling strangeness reminiscent of Stanley Kubrick.

If ''The Matrix'' were a video game -- I know there is one, but I mean the movies themselves -- then you could linger in that dazzling white subway station, or in the Oracle's kitchen while the cookies are baking and tune out all of the philosophical mumbo jumbo and action-movie clich√©s. You could reflect on the curious beauty of your surroundings and admire the skill of the architects (not to be confused with the Architect). ''The Matrix Relaxed'' -- now there's an idea for a sequel. 

''The Matrix Revolutions'' is rated R (Under 17 requires accompanying parent or adult guardian). There is some graphic violence and bad language. THE MATRIX REVOLUTIONS 

Written and directed by the Wachowski Brothers; director of photography, Bill Pope; edited by Zach Staenberg; music by Don Davis; production designer, Owen Paterson; visual effects supervisor, John Gaeta; produced by Joel Silver; released by Warner Brothers Pictures. Running time: 129 minutes. This film is rated R. 

WITH: Keanu Reeves (Neo), Laurence Fishburne (Morpheus), Carrie-Anne Moss (Trinity), Hugo Weaving (Agent Smith), Jada Pinkett Smith (Niobe), Mary Alice (the Oracle), Lambert Wilson (Merovingian), Harold Perrineau (Link), Harry Lennix (Commander Lock) and Monica Bellucci (Persephone). "
11,The Devil's Advocate,"Meet Faust in fancy cowboy boots: Kevin Lomax, the lawyer played by Keanu Reeves in Taylor Hackford's unexpectedly seductive ''Devil's Advocate.'' Kevin is at the heart of a high-concept sentence (''Slick yuppie is co-opted by slicker New York Satan'') that has been spun into a lavish-looking, cleverly entertaining morality play with shades of ''Rosemary's Baby,'' ''Wall Street'' and countless other tales of selling out to Manhattan's temptations.

This time it's the devil as head honcho at a law firm, with Al Pacino having great, wily fun with the screenplay's bons mots. ''Look at me, underestimated from Day One!'' bellows this executive, who has a taste for fashionably urbane black. ''You'd never think I was a Master of the Universe, now wouldya?''

His idea of such mastery definitely goes beyond Tom Wolfe's.

With a gratifyingly light touch, the screenplay by Jonathan Lemkin and Tony Gilroy (adapted from a novel by Andrew Neiderman) names Mr. Pacino's character John Milton, since he knows a thing or two about paradise lost. And it is in Gainesville, Fla., that they first find the ambitious Kevin, who thinks he has much to gain. Kevin, played with uncharacteristic sharpness by Mr. Reeves as a smart and debonair hotshot, is first seen successfully defending an unsavory schoolteacher against a charge of molesting a student (Heather Matarazzo of ''Welcome to the Dollhouse''). Then, with his gorgeous and sultry wife, Mary Ann (Charlize Theron), he celebrates this dubious victory. High on his own career trajectory, Kevin is in a mood to say yes when a strange lawyer flashes a big check and tries luring him to Manhattan.

The firm that summons Kevin has business in places like the Middle East, the Balkans, Central America and West Africa. It has a receptionist named Caprice. It has a witchily beautiful temptress called Christabella (Connie Nielson). And it has the devilishly understated penthouse lair of Milton, complete with Purgatory artwork and a big roaring fire. Bruno Rubeo's deft production design, handsomely photographed by Andrzej Bartkowiak with the same burnished look he has given many Sidney Lumet films, gives this place a stark minimalism that is one part sleek efficiency, one part torture chamber. Running water cascading off the open edge of a terrace is one of the film's many ways of suggesting souls on the brink.

The Lomaxes are given a big apartment and Mary Ann stays home the way Rosemary did, painting the place while her husband advances his career. Meanwhile, Kevin stays preoccupied and becomes increasingly seduced by the cases that come his way. One involves Delroy Lindo as a mysterious figure accused of sacrificing goats in his ghetto basement. Another features Craig T. Nelson as a developer living in Trump-like, gilded splendor. The film's more mischievous tricks include using Donald Trump's real apartment as a set, since Versailles was perhaps unavailable, and producing Senator Alfonse D'Amato at a party scene for the Devil's law firm.

Meanwhile, Mary Ann starts having trouble. She misses her husband. She is pursued by Milton, who talks her into doing something drab to her beautiful blond hair. She receives equally unhelpful decorating advice from fellow corporate wives and abandons her favorite color, though Mary Ann's bright green figures sadly in a later hospital scene. During one outing with these women, complete with shopping, chardonnay and talk of plastic surgery, Mary Ann suddenly sees a terrifying vision.

The film uses morphing and Rick Baker's monster effects strikingly, but it also keeps its gimmicks well tethered to reality: an afternoon like Mary Ann's might be enough to make anyone see demons. Later on, Kevin's wandering eye yields an unsettling sex scene in which two different women in his life are suddenly made indistinguishable. Mr. Hackford uses diabolical editing at strategic moments to confuse identities in this way. While there is no small irony in a big Hollywood film's finger-wagging about the seductions of wealth and power, ''Devil's Advocate'' does avoid clumsy moralizing and old-hat notions of good and evil. It helps that Kevin is no naif, and that his churchgoing Mama (Judith Ivey) sees Manhattan as ''a dwelling place of demons'' well before that perception becomes unavoidable. It helps that the film finds Faustian deal making and yuppie ambition not very different. And it also helps that in this, the ultimate lawyer joke of a movie, it becomes so clear why Kevin's legal talents are the Devil's instruments of choice. Mr. Pacino's mischievous Milton eventually notes that nobody on earth could do his bidding better than a well-trained band of attorneys. If those attorneys are as pampered as Kevin threatens to become, so much the better. As Milton likes to point out, ''Vanity is definitely my favorite sin.''

(Special trailer note: Lurid advance ads for ''Devil's Advocate'' make it look ridiculous. It's not.) 
''Devil's Advocate'' is rated R (Under 17 requires accompanying parent or adult guardian). It includes profanity, sexual situations and frontal nudity. THE DEVIL'S ADVOCATE 

Directed by Taylor Hackford; written by Jonathan Lemkin and Tony Gilroy, based on a novel by Andrew Neiderman; director of photography, Andrzej Bartkowiak; edited by Mark Warner; music by James Newton Howard; production designer, Bruno Rubeo; makeup effects, Rick Baker; produced by Arnon Milchan, Arnold Kopelson and Anne Kopelson; released by Warner Brothers. Running time: 130 minutes. This film is rated R. 

WITH: Keanu Reeves (Kevin Lomax), Al Pacino (John Milton), Charlize Theron (Mary Ann Lomax), Judith Ivey (Mrs. Lomax), Connie Nielson (Christabella), Heather Matarazzo (student) and Craig T. Nelson (Alexander Cullen). "
