139,Hoffa,"IN his 1960 book, ""The Enemy Within,"" Robert F. Kennedy, soon to be the Attorney General of the United States, wrote about his first face-to-face meeting with the man he had sworn to send to prison, James R. Hoffa, the powerful president of the International Brotherhood of Teamsters. Kennedy was surprised by how short the labor leader was, ""only five feet five and a half.""

Anyone who knows anything about Hoffa's rise and fall will be similarly surprised by how much he's grown in ""Hoffa,"" the riveting, almost impressionistic new film biography, written with mean brilliance by David Mamet and directed by Danny DeVito in a splashy style best described as Las Vegas Empire.

The film not only presents a Jimmy Hoffa with the beefed-up physical dimensions of Jack Nicholson, who gives a gigantic powerhouse of a performance, but it also effectively rearranges the hierarchy of American heroes as it's understood in the 1990's. Many people may be uncomfortably surprised.

""Hoffa"" sees Kennedy, who was assassinated in 1968 in the middle of his campaign for the Democratic Presidential nomination, as he was perceived by Hoffa: a whiny, aggressive, Harvard-educated rich kid desperate for publicity, ready to use fair means and foul to trap Hoffa, and no match at all for Hoffa in their furious verbal confrontations.

Mr. DeVito and Mr. Mamet don't whitewash Hoffa, but they seem almost nonjudgmental about him. By omission they appear to sanction a complicated, very dubious, if colorful, character. In the context of most commercial movies today, which insist on explaining too much or repeating the obvious at seemingly endless length, ""Hoffa"" remains cool and detached, not unlike Mr. DeVito's very funny, very dark comedy, ""The War of the Roses."" Yet ""Hoffa"" is not a comedy. It is a take on history.

It's a serious consideration of the career of a man whose gift for the expedient and personally profitable alliance was the near-equal of Talleyrand's. Hoffa's ties to the Mafia not only cost the rank-and-file teamsters millions of dollars but also set a pattern for corruption that tainted the entire labor movement. His is a quintessentially American story, for only in America did Big Labor become a big business to rival Big Business.

""Hoffa"" is a remarkable movie, an original and vivid cinematic work, but is that enough? I think it is. Others will have legitimate objections to the ways the film operates.

Mr. DeVito and Mr. Mamet stay at a discreet distance from Hoffa, neither sentimentalizing him nor attempting to analyze him beyond his own automatic defense that you have to do it unto others before others do it unto you. Without comment, and in very general terms, they document Hoffa's evolution from small-time labor reformer to big-time labor racketeer, master shakedown artist and influence-peddler, and friend to mobsters of frightening moment.

The tale is told in a series of flashbacks from the last day of Hoffa's life. On July 30, 1975, Hoffa disappeared forever, having been shot, according to some reports, his body placed inside an automobile compactor, the remains then buried in a location that no one yet has discovered.

The movie opens as the nervous, exhausted Jimmy, accompanied by his trusted factotum and pal, a fictitious character named Bobby Ciaro (Mr. DeVito), waits in the back seat of a Cadillac in the parking lot of a roadhouse near Detroit. Jimmy has an appointment with a long-time Mafia associate who, he hopes, will support him in his attempts to win back his place as the teamsters' president. Convicted of jury-tampering and sent to jail in 1967, Jimmy was paroled in 1971 on the condition that he remain out of union politics until 1980. It's not a condition he has ever taken seriously.

The recollections that are the body of the film are not Jimmy's, but the adoring, busy Bobby's. Bobby can't sit still. He paces around the parking lot, goes into the roadhouse to make phone calls, returns with paper cups of coffee for Jimmy, reminisces a bit, gets out of the car again and paces.

Bobby frets over Jimmy's situation, recalling his first meeting with the vital, energetic Jimmy in the depressed 1930's when, one night on the road, Jimmy invited himself into the cab of his truck and attempted to recruit him for the teamsters. Jimmy was then something of an idealist. As the long day passes in the parking lot, Bobby chronologically remembers his way through Jimmy's career: their days as members of a teamster goon squad, torching a company that failed to recognize the union; Jimmy's success in a brutal confrontation with police while organizing the Railway Transport workers, and his introduction to the Mafia in the person of (the fictitious) Carol D'Allesandro (Armand Assante). He's the film's representation of the forces that provided much of the pressure and muscle that made possible Hoffa's rise within the teamsters' union.

In one of the film's more bizarre inventions, Bobby remembers a crucial hunting trip during which D'Allesandro outlines the ways Jimmy might manipulate the teamsters' pension fund to make loans to the mob and enrich all concerned, with the exception of the membership. As the two men are signing an agreement on the back of a hunting license, Bobby, not a natural hunter, spots a sluggish deer, takes out his pistol and shoots it between the eyes.

Although Bobby's memory is fond, ""Hoffa"" sees all impassively, with a shrug that seems to ask, ""Well, what can you do about it?"" This gives ""Hoffa"" a bitterly skeptical edge that is rare in American movies. It forces viewers to make up their own minds, something that can be immensely disorienting as well as rewarding. The film suggests there are times when you have to think for yourself.

A more reasonable objection to the movie is the way it necessarily foreshortens history, simplifies events, and either ignores important real-life characters or reinvents them as composites. This is dramatic license, but dramatic license often seriously distorts, which is not easily acceptable when the subject is as rich and significant as the Jimmy Hoffa story.

The movie notes in passing, but doesn't appear to understand, Hoffa's real achievement in negotiating the precedent-setting National Master Freight Agreement, guaranteeing teamsters uniform wage and benefit conditions across the country. The movie also doesn't begin to suggest the profound complexity of Hoffa's connections to the mob, his relations to his wife and family, and the teamsters' connections to the Government. A lot has been left out, which is unfortunate, since the snarl of these relationships is what seems finally to have done him in.

The great thing about ""Hoffa"" is that it doesn't pretend to be a docudrama or anything like it. It's not a vulgarized rip-off of Costa-Gavras movies, reduced to the exploitation of the latest case of murder, kidnapping or child molestation, or a briefly notorious domestic disagreement. ""Hoffa"" is an original work of fiction, based on fact, conceived with imagination and a consistent point of view.

In addition to Mr. Assante and Mr. DeVito, the excellent supporting cast includes J. T. Walsh as Hoffa's colleague and successor, Frank Fitzsimmons; John C. Reilly as a protege who squeals on Hoffa; Natalija Nogulich, briefly seen as Jimmy's wife; Kevin Anderson as Robert Kennedy; Frank Whaley as a young man befriended by Bobby in the course of the day in the roadhouse parking lot, and Robert Prosky as another early associate of Jimmy.

Mr. DeVito's direction is full of extravagant gestures that seem entirely in keeping with Bobby's highly colored memories of life with Jimmy. There are a number of grand overhead shots, as if the camera were in the position of a gaudy casino chandelier, whether it's a scene of Jimmy in prison or a panoramic view of union men fighting scabs. At the same time, Mr. DeVito knows when to use close-ups, that is, to reveal character rather than to punctuate dialogue. When the director shows a remembered explosion and fire, they have the huge proportions of something reported in a tall story told late at night in a favorite bar.

Mr. Nicholson has altered his looks, voice and speech to evoke Hoffa, but the performance is composed less of superficial tricks than of the actor's crafty intelligence and conviction. The performance is spookily compelling without being sympathetic for a minute. Unlike Norman Jewison's ""F.I.S.T."" (1978), an underrated Sylvester Stallone movie about a Hoffa-like character, the new film doesn't mourn Jimmy's lost innocence. ""Hoffa"" is a tough movie about American life. It hasn't time for tears.

""Hoffa,"" which has been rated R (Under 17 requires accompanying parent or adult guardian), is full of obscene language and violence. Hoffa Directed by Danny DeVito; written by David Mamet; director of photography, Stephen H. Burum; edited by Lynzee Klingman and Ronald Roose; music by David Newman; production designer, Ida Random; produced by Edward R. Pressman, Mr. DeVito and Caldecot Chubb; released by 20th Century Fox. Running time: 110 minutes. This film is rated R. James R. Hoffa . . . Jack Nicholson Bobby Ciaro . . . Danny DeVito Carol D'Allesandro . . . Armand Assante Frank Fitzsimmons . . . J. T. Walsh Pete Connelly . . . John C. Reilly Young Kid . . . Frank Whaley Robert Kennedy . . . Kevin Anderson Red Bennett . . . John P. Ryan Billy Flynn . . . Robert Prosky Jo Hoffa . . . Natalija Nogulich Hoffa's Attorney . . . Nicholas Pryor"
142,Apollo 13,"THE line of dialogue that will be best remembered from Ron Howard's absolutely thrilling new ""Apollo 13"" is a slight variation on the truth. ""Houston, we have a problem,"" says one of this film's three endangered astronauts, although ""Houston, we've had a problem"" is what Jim Lovell actually said. It's a small but important change, one more way that ""Apollo 13"" unfolds with perfect immediacy, drawing viewers into the nail-biting suspense of a spellbinding true story. You can know every glitch that made this such a dangerous mission, and ""Apollo 13"" will still have you by the throat.

Better even than Mr. Howard's sure hand with this fascinating material is his film's unexpected restraint. ""Apollo 13"" understands the difference between movie bravado and real courage, and it celebrates the latter in inspiring ways that have almost gone out of style. With Tom Hanks, wonderful again, as the Everyman in the driver's seat, ""Apollo 13"" isn't afraid of the stone-cold fear at the heart of this tale or of the intricate group effort needed to see it through. This film and its brave, believable characters are uplifting in ways that have nothing to do with a voyage to outer space.

We take it for granted today that there have been a hundred manned American space flights, and that an astronaut can remain in orbit almost unnoticed for a three-month stretch. But the weeklong adventure of the Apollo 13 crew unfolded in a very different atmosphere. In April 1970, the space program still aroused strong emotions: attention had begun to wane after the previous year's moon walk, but the nation found itself desperately receptive to the astronauts' unforeseen display of heroism after their flight became so perilous. ""Apollo 13"" doesn't mention Vietnam, but it doesn't have to. The war-weary climate of that time enhances this film's wishful, stirring faith in American know-how.

Like ""Quiz Show,"" ""Apollo 13"" beautifully evokes recent history in ways that resonate strongly today. Cleverly nostalgic in its visual style (Rita Ryack's costumes are especially right), it harks back to movie making without phony heroics and to the strong spirit of community that enveloped the astronauts and their families. Amazingly, this film manages to seem refreshingly honest while still conforming to the three-act dramatic format of a standard Hollywood hit. It is far and away the best thing Mr. Howard has done (and ""Far and Away"" was one of the other kind). Equally sound was casting his own mother (Jean Speegle Howard) as Jim Lovell's mother, a real corker. ""Are you boys in the space program, too?"" she sweetly asks the film's Buzz Aldrin and Neil Armstrong.

""Apollo 13"" makes it unsurprising that Jim Lovell (""no stranger to emergencies he,"" a television commentator says) would come from sturdy stock. Mr. Lovell is presented as a quietly gung-ho commander, the kind of man who tells his wife (played brightly and affectingly by Kathleen Quinlan) that he's going to the moon as if that's great news. For Mr. Lovell, on whose memoir, ""Lost Moon"" (written with Jeffrey Kluger), the film is based, it actually was: he had come tantalizingly close to the moon on the Apollo 8 flight and enthusiastically looked forward to a lunar landing. Instead, on a mission whose original flight plan was abruptly aborted, he was lucky to come home alive.

The science behind ""Apollo 13"" is detailed and specific, and the film conveys it with superb simplicity. Easy as it would have been to sling showy high-tech jargon, the screenplay (credited to William Broyles Jr. and Al Reinert) is gratifyingly terse and clear. With a pitch-perfect ear for NASA syntax (""Come on, rookie, park that thing""), the film stays informative while dealing with arcane facts that became matters of life and death. You may see no more dazzling display of ingenuity all year than the authentic way the film's NASA technicians scramble with cardboard and duct tape to make a square peg fit a round hole.

In terms of realism, nothing else here comes close to the staggering fact that some of the film's zero-gravity scenes were shot aboard a KC-135 NASA plane on a steep parabolic orbit that earned it the nickname ""vomit comet."" Some may feel that Mr. Hanks, Kevin Bacon and Bill Paxton, who play the astronauts so expertly, deserve something better than the usual end-of-the-year recognition for having even taken these roles.

These three stars (and their terrific backup teammates on the ground, especially Gary Sinise as Ken Mattingly, an astronaut benched at the last minute because of a measles scare, and Ed Harris as the nail-spitting flight commander, Gene Kranz) capture an extraordinary verisimilitude. No film about space travel has done a more realistic job of conveying the strangeness and exhilaration of such exploits, not to mention the terror summed up by Mr. Bacon's Jack Swigert: ""If this doesn't work, we're not going to have the power to get home.""

Crippled by the explosion of one of its oxygen tanks as it neared the moon, the spaceship Odyssey experienced sudden electrical failures that forced the astronauts to shut it down. They took refuge in their lunar exploration module, the Aquarius, which was neither built nor programmed to bring three men back to earth. Computer readjustments, navigational problems, lack of heat in space, fear of incineration on re-entry, condensation that made the flight ""a little like trying to drive a toaster through a car wash"": all these troubles are grippingly dealt with in cinematically unconventional ways. When the guys in this film frantically get out their slide rules, they're executing a gutsier rescue than the maneuvers of any cape-wearing cartoon superhero.

Thanks largely to Mr. Hanks' foursquare presence here, the empathy factor for ""Apollo 13"" is through the roof. This actor's way of amplifying the ordinary side of an extraordinary character remains supremely fine-tuned. Playing the tough, commanding Jim Lovell is a substantial stretch for Mr. Hanks, but as usual his seeming ingenuousness overshadows all else about the role. There's not a false move to anything he does on screen. Once again, he gives a performance that looks utterly natural and is, in fact, subtly new.

The other principal performances are equally staunch, giving vivid, likable impressions of characters whose rough edges have been only slightly smoothed. (The fact that Gene Kranz liked to start his day listening to John Philip Sousa marches, as reported in Andrew Chaikin's lucid Apollo overview, ""A Man on the Moon,"" is the kind of thing not dealt with by Mr. Harris's tight, steely performance.)

Also notable about ""Apollo 13"": James Horner's rousing music, convincing rocket scenes that don't come from NASA and an authentic glimpse of the role of television reporting during the Apollo crisis. The news media can be faulted for some of the behavior seen here, but Mr. Howard doesn't waste time taking those potshots. Truly, ""Apollo 13"" has better things to do.

""Apollo 13"" is rated PG (Parental guidance suggested). It includes very mild profanity and very brief sexual situations. Children old enough to follow its story should love it -- and they'll find out how to go to the bathroom in space. APOLLO 13 Directed by Ron Howard; written by William Broyles Jr. and Al Reinert, based on the book ""Lost Moon,"" by Jim Lovell and Jeffrey Kluger; director of photography, Dean Cundey; edited by Mike Hill and Dan Hanley; music by James Horner, with vocal performance by Annie Lennox; production designer, Michael Corenblith; costumes by Rita Ryack; produced by Brian Grazer; released by Universal Pictures. Running time: 135 minutes. This film is rated PG. WITH: Tom Hanks (Jim Lovell), Kevin Bacon (Jack Swigert), Bill Paxton (Fred Haise), Gary Sinise (Ken Mattingly), Ed Harris (Gene Kranz), Kathleen Quinlan (Marilyn Lovell) and Jean Speegle Howard (Blanch Lovell)."
145,Twister,"LEAD: The yellowy-gray clouds are ominous, but the weather is still trying to make up its mind. The winds are warm, gusty. A little girl, Violet, hauls a vacuum cleaner across the lawn toward the swimming pool. On a small knoll behind her stands an all-American mansion, part Mount Vernon, part suburban split-level.

The yellowy-gray clouds are ominous, but the weather is still trying to make up its mind. The winds are warm, gusty. A little girl, Violet, hauls a vacuum cleaner across the lawn toward the swimming pool. On a small knoll behind her stands an all-American mansion, part Mount Vernon, part suburban split-level. It looks both cheesy and expensive.

The big white house is the centerpiece of the tacky Kansas estate of a self-made millionaire named Cleveland (Harry Dean Stanton), whose money comes from miniature golf and from soda pop that is colored an especially ghastly shade of green. The house and everything in it appear to have been purchased in a single afternoon at a second-rank department store.

At the beginning of Michael Almereyda's spaced-out comedy, ''Twister,'' Cleveland is thinking of investing in miniature cows - ''half the size, twice the milk.'' The only disadvantage is that they tend to get lost in the weeds and become the prey of turkeys and cats.

With a certain amount of good will and no great ability, Cleveland presides over a household that includes his daughter, Maureen (Violet's unwed mother), who drinks too much and describes herself as a 24-year-old failure; his androgynous son, Howdy, who favors black leather pants that look good with his guitar, and Chris, Violet's father, who has returned from Canada to save Maureen and Violet from what he calls ''this loony bin.''

At the moment, Maureen wants nothing to do with Chris. Howdy is courting Stephanie, a pretty, dim young woman who doesn't much like Howdy, and Cleveland is about to marry Miss Virginia, a local television celebrity. Miss Virginia is the emcee of ''Wonderbox,'' a Sunday-morning children's show in which, dressed up like Judy Garland in ''The Wizard of Oz,'' she teaches children about weather, animals and God.

''Twister,'' adapted by Mr. Almereyda from Mary Robison's novel ''Oh!,'' opens today at Anthology Film Archives, which is somewhat off the beaten track on the Lower East Side. The trip, however, is well worth the effort for anyone whose sensibilities have been worn numb by the idiocies of most conventional films.

''Twister'' looks conventional, but nothing works in the ordinary way. It plays less like a movie than like a novel that one reads at one's own speed. The movie is full of pauses, digressions and blind alleys. Sometimes it seems to stop completely.

Like the often tiresome Howdy (played by the often tiresome Crispin Glover), it also seems both aggressive and shy, especially in the way it forces the audience to accept its curious, uninflected narrative. No one event is really any more important than another.

The real subject of the film is the lazy end of American civilization. No apocalypses. No bangs. Not even any whimpers. Everything just sort of grinds down into uneasy, well-upholstered boredom haunted by guilt. Cleveland and his kids have a lot of money and not the foggiest notion how to spend it to have a little fun. They are as without purpose as tadpoles.

There's not much in the way of a story except the title phenomenon, the tornado that isn't even seen on screen.

''Twister'' is composed entirely of random vignettes in which Cleveland, Miss Virginia, Maureen, Howdy, Chris and the rest float around, trying to make contact with one another and failing.

At one point Maureen and Howdy decide they must find their long-lost mother in order to forgive her for abandoning them. Their clue to her whereabouts is a picture of a woman who bears a remarkable resemblance to Amelia Earhart and, indeed, is Amelia Earhart, though they don't know it.

After the storm, Miss Virginia gets everyone to play a game. What would each person do if God told him that he had one hour to live? Howdy would write a song. Stephanie says that she would see a doctor.- This is before she has been fired from her job at the high school for damaging some ''major shrubs.''

The jokes are small but invitingly odd, the ending happy and thoroughly bleak. Suzy Amis and Dylan McDermott are very attractive as Violet's inarticulate, occasionally loving parents. Mr. Stanton, like the character he plays, remains a little detached. He watches his messed-up children as if he still loved them but had long since given up trying to understand them.

Tim Robbins and William Burroughs appear in cameo roles, though it is Lois Chiles who makes the film's funniest, most vivid impression in a role that could have been inspired by the public personality of Anita Bryant.

''Twister'' is not an easy film to categorize, which is its charm and the reason it has not received a conventional commercial release. It's one of those entertaining what's-its that are most vulnerable at a time when every movie that isn't a smash hit is automatically regarded as an instant flop.

Long live the mysterious in-between.

''Twister,'' which has been rated PG-13 (''Special Parental Guidance Suggested for Those Younger Than 13''), includes vulgar language. 

APPROACHING A LAZY END - TWISTER, written and directed by Michael Almereyda; camera, Renato Berta; edited by Roberto Silvi; music by Hans Zimmer; production designer, David Wasro; produced by Wieland Schulz-Keil; released by Vestron. At Anthology Film Archives, 32 Second Avenue, at Second Street. Running time: 93 minutes. This film is rated PG-13. 

Cleveland...Harry Dean Stanton 
Maureen...Suzy Amis 
Howdy...Crispin Glover 
Chris...Dylan McDermott 
Virginia...Lois Chiles 
Lola...Charlaine Woodward 
Jenny...Stephanie Wright"
