52,As Good as It Gets,"James L. Brooks's ''As Good as It Gets'' echoes the quirky appeal of his ''Broadcast News,'' and that's high praise. Nobody does a better job of backing characters into happiness than Mr. Brooks, especially when those characters are high-strung enough to leave happiness practically out of the question. Though this is a looser and less even comedy, it shows off Mr. Brooks's gift for the right-on zinger and his sweet, rueful way of enjoying his characters' stubborn tics.

''You look at someone long enough, you discover their humanity,'' says Simon Bishop (Greg Kinnear), the film's gentlest soul, as he talks of painting portraits. In its own shaggy-dog fashion, the film does the same.

Mr. Brooks's prime invention here is Melvin Udall, who would deserve his own situation comedy if anything he said were fit for the airwaves. A hilarious misanthrope, Melvin is such a versatile bigot that he gets in lots of mileage without even leaving home. The film barely begins before Melvin taunts Simon, who is gay: Simon's art dealer (Cuba Gooding Jr.), who is gay and black, and Simon's pet, Verdell (Jill), who is a dog. Melvin tosses Verdell down the incinerator chute in his first display of neighborliness.

Jack Nicholson, whose last couple of film performances (''The Evening Star,'' ''Mars Attacks!'') were virtually phoned in, is delightfully reinvigorated by Melvin's miserableness. And for an additional actor's bonus, there is the obsessive-compulsive disorder meant to explain something about Melvin's disposition. Melvin is the kind of guy who sorts his M & M's by color and takes plastic silverware to the only restaurant he is willing to patronize. So into the film comes a wisecracking waitress named Carol (Helen Hunt), the only woman on earth whom Melvin will allow to serve him breakfast.

Carol, the hard-luck sister of Holly Hunter's ''Broadcast News'' heroine with a touch of Alice Kramden thrown in, worries about the health of her young son while tolerating Melvin in fond, vinegary fashion. ''When I first saw you, when you first came in to breakfast, I thought you were handsome,'' she eventually tells him. ''Then, of course, you spoke.'' It's clear from the start that this tart yet warmly entertaining film will eventually find a way of letting these two opposites attract. But in the process, which also involves Mr. Kinnear's affectingly played Simon, Mr. Brooks finds plenty of time for sharp writing and witty diversions. So if the film teeters over a subplot that has Simon badly beaten, it does find something amusing in the way hospital visitors can actually make the patient feel worse. And the film, which gives Ms. Hunt's irresistible Carol a sick son who preoccupies her, delivers more medical humor when Melvin supplies a free doctor to help the boy.

While Carol and her mother (Shirley Knight, tenderly funny) jump for joy over the idea of a house call, the visiting nurse murmurs: ''I'm sorry it took so long. I don't know Brooklyn.'' Replies the doctor (Harold Ramis): ''I couldn't find it either.'' Mr. Brooks's view of human nature here may not go much deeper than great gags, but there are enough of them to keep ''As Good as It Gets'' as winning as it is barbed. When Melvin, a successful writer of 62 awful-sounding books, is gushed over by a fan who asks him how he writes women so well, he glares and then announces: ''I think of a man. And I take away reason and accountability.'' Wicked, but it works. 
''As Good As it Gets'' is rated PG-13 (Parents strongly cautioned). It includes partial nudity, one violent sequence, scattered profanity and a string of outrageous slurs that are successfully played for laughs.


AS GOOD AS IT GETS 

Directed by James L. Brooks; written by Mark Andrus and Mr. Brooks, based on a story by Mr. Andrus; director of photography, John Bailey; edited by Richard Marks; music by Hans Zimmer; production designer, Bill Brzeski; produced by Bridget Johnson, Kristi Zea and Mr. Brooks; released by Tri-Star Pictures. Running time: 130 minutes. This film is rated PG-13. 

WITH: Jack Nicholson (Melvin Udall), Helen Hunt (Carol Connelly), Greg Kinnear (Simon Bishop), Cuba Gooding Jr. (Frank Sachs), Skeet Ulrich (Vincent), Shirley Knight (Beverly), Yeardley Smith (Jackie), Lupe Ontiveros (Nora) and Jill (Verdell). "
56,What Dreams May Come,"It wasn't so long ago that love, in Hollywood-speak, was supposed to mean ''never having to say you're sorry.'' ''What Dreams May Come,'' one of the most elaborate metaphysical love stories ever tackled by Hollywood, lays out a whole new set of irritating catch phrases to define the quest for a love that triumphs over death. These range from the blunt ''Never give up,'' which is repeated like a mantra throughout the movie, to portentous utterances about winning when you lose and losing when you win.

''What Dreams May Come,'' based on a novel by Richard Matheson and directed by Vincent Ward, the New Zealand filmmaker noted for his skill at creating lavish cinematic dreamscapes, represents the uncomfortable collision of two ideas about filmmaking, one commercial, the other eccentrically, ambitiously dreamy. On the commercial level, it is an ecumenically canny exercise in pop inspiration that's smart enough to drop the name ''God'' only once, in a vague, nondogmatic reference.

The story of the world's happiest couple, who after both dying tragic deaths meet again in the afterlife, wants to be a more grown-up, sophisticated ''Ghost.'' This feel-good allegory, chock-full of celestial special effects and sentimental reunions, comes with an uplifting triple-decker finale in the manner of ''Titanic.''

Robin Williams, with his Humpty Dumpty grin and crinkly moist eyes dripping with empathy, is Chris Nielsen, a gifted pediatrician, doting husband and father of two, who, in a feat of metaphysical heroism, travels into the netherworld to rescue his wife and soul mate, Annie (Annabella Sciorra), from eternal damnation. Annie is a painter and museum worker who commits suicide (and is condemned to live in hell for taking her own life) after Chris is killed in a car accident.

Four years earlier, the couple's two children, Marie (Jessica Brooks Grant) and Ian (Josh Paddock), also died in a car wreck that left both parents shattered. At that terrible moment, Chris's devotion pulled Annie out of a near-suicidal depression.

Working from a screenplay by Ron Bass, Mr. Ward has created a film that at its most visually evocative portrays its characters' lives and afterlives as a kind of hall of mirrors, in which the lines between dream and reality, memory and eternity are continually blurring as one gives way to another. At its most seductive, the film portrays heaven as a magical, hallucinatory extension of the physical world that has been left behind. It is a place flooded with dim golden light and thick with flowers, of misty peaks and crags, where people and objects float through the sky and great distances can be breached with a single leap (of faith, of course).

When Chris first arrives in heaven, he finds himself inside one of Annie's Gothic romantic paintings. After crunching down in a flower bed, he gets up to find himself covered with paint, as though he had landed on a just-completed three-dimensional Renoir canvas that was still wet.

The underworld he visits with the help of a grim-faced guide played by (who else?) Max von Sydow is a grim but PG-13-looking place (when it comes to punishment and suffering) surrounded by burning shipwrecks. In the most powerful image of hell, one that is intensely claustrophobic, Chris is forced to run across a sea of muttering heads all craning up through an endless expanse of mud.

But for all their visual fascination, these images don't seem connected to real people. Mr. Bass's screenplay is so clotted with slogans, riddles and dime-store psychobabble that Chris and Annie never coalesce into anything more than a pair of idealized greeting-card parents with terrible luck. The movie doesn't give them enough earthly screen time for us to get to know them. Brief flashbacks find Chris arguing with his son about school, but they try to cram too much information into too small a space for the relationship to develop any substance.

And all the weeping and hugging the characters do can't make up for the film's fatal lack of texture and psychological nuance. Cuba Gooding Jr. is glaringly miscast as an angel who guides Chris through his first days in heaven and who turns out to be -- well, you'll have to see the movie to find out.

It's often been said that baby boomers think they can live forever. ''What Dreams May Come'' is the movie that tells them, yes, it's possible, at least in a solipsistic New Age sense, to attain eternal life. That's because eternity, the movie soothingly suggests, is whatever you imagine it to be. If you can conjure it up, then on some level it must be reality. Just like ''Peter Pan.'' Close your eyes, snap your fingers and you can fly. 
''What Dreams May Come'' is rated PG-13 (Parents strongly cautioned). It deals with an uncomfortable subject (death) and has scary images of hell.  WHAT DREAMS MAY COME 

Directed by Vincent Ward; written by Ron Bass, based on the novel by Richard Matheson; director of photography, Eduardo Serra; edited by David Brenner and Maysie Hoy; music by Michael Kamen; production designer, Eugenio Zanetti; produced by Stephen Simon and Barnet Bain; released by Polygram Filmed Entertainment. Running time: 106 minutes. This film is rated PG-13. 

WITH: Robin Williams (Chris Nielsen), Cuba Gooding Jr. (Albert), Annabella Sciorra (Annie Nielsen), Max von Sydow (the Tracker), Jessica Brooks Grant (Marie Nielsen) and Josh Paddock (Ian Nielsen).. "
62,Snow Falling on Cedars,"'Snow Falling on Cedars'' is an almost heartbreaking example of what can happen when a filmmaker becomes so overawed by his source that he confuses dramatic storytelling with the production of mammoth coffee-table art books. Bathed in deepening shades of snow-lit Prussian blue, this screen adaptation of David Guterson's popular 1994 novel is admirably high-minded and visually gorgeous but fatally anesthetized by its own grandiosity.

Frame by frame the movie, directed by Scott Hicks (of ''Shine'') and filmed by Robert Richardson (the virtuoso cinematographer behind several Oliver Stone movies), isn't just a series of shots but a sequence of exquisitely balanced photographic compositions. The piling on of so much visual beauty, however, only contributes to the sense of the movie as a frozen artifact cut off from the real world and designed to be viewed from behind a glass casement.

There's a lesson here about the aesthetics of mass-audience movies. Pretty pictures, as nice as they may be, are finally no substitute for a living, breathing screenplay. And ''Snow Falling on Cedars,'' like many an elegant coffee-table book, has a skimpy text (by Mr. Hicks and Ron Bass) that too often substitutes distilled, poeticized oration for everyday speech.

Hardly a moment passes when we're not conscious of the movie's messages about tolerance and forgiveness being shoved in our faces. Even when they are delivered by an actor as gifted as Max von Sydow, playing a defense lawyer who is the movie's official conscience, ''Snow Falling on Cedars'' rings with the hollow boom of a Sunday school sermon.

Perhaps the biggest mistake in translating the novel to the screen was to have the film imitate the book's intricate flashback structure. Flipping back and forth between the present and the past on the page is one thing. (It encourages your imagination to make leaps and allows you to take whatever time you need to bridge those transitions.) But when a movie does the same thing, the imagination is short-circuited, and there is hardly time for reflection. The film is so busy darting back and forth between past and present that from scene to scene its characters barely have time to breathe.

There are also far too many lingering close-ups of haunted faces. And a surreal montage that harks back to the early films of Alain Resnais (specifically ''Hiroshima, Mon Amour''), brings the movie to a dead halt. This might have been a coup de cinema in another film, but here it seems narratively evasive.

The story unfolds as a series of flashbacks from the 1950 murder trial of Kazuo Miyamoto (Rick Yune), a young Japanese-American accused of killing a fisherman on his boat off the coast of the fictitious San Piedro Island, north of Puget Sound. Most of the events are seen through the eyes of Ishmael Chambers (Ethan Hawke), a morose young reporter covering the trial for the local newspaper. Many years earlier Ishmael and the defendant's wife, Hatsue (Youki Kudoh), were teenage lovers who met secretly in the hollow trunk of a cedar tree deep in the rain forest. The affair ends when it is discovered by Hatsue's mother, who is vehemently opposed to interracial relationships.

The film's strongest scenes look back to World War II when the island's Japanese-Americans were interrogated, rounded up and sent to internment camps for the duration of the war. The murder trial revolves around the bitterness surrounding a land deal on which Kazuo's family defaulted while imprisoned. During the trial, the prosecutor (James Rebhorn) blatantly appeals to the local whites' lingering anti-Japanese prejudice in speeches that play on the racist stereotype of Asians as treacherous and inscrutable.

As the movie jumps back and forth in time, we meet Ishmael's late father, Arthur (Sam Shepard), the crusading local newspaper editor who stood up to the anti-Japanese hysteria that swept the community after the bombing of Pearl Harbor. Nine years later Ishmael, poring over evidence in the case, decides to strike his own blow for truth and justice.

''Snow Falling on Cedars'' may be dramatically inert, but it is well acted, and it succeeds in sustaining a mood of spellbound reflection. The endless swirling snow, the blue-lit fog and the rain forest with its dripping evergreens evoke a brooding interior landscape where memory and reflection loom solemnly over the present.

But even this mood is undermined by James Newton Howard's bombastic score, which suggests the romantic minimalism of Michael Nyman encrusted with heavenly vocal choirs. The overwrought score is the final lethal touch in a movie that buckles under the weight of its own pretensions. 

''Snow Falling on Cedars'' is rated PG-13 (Parents strongly cautioned). It has sexual situations. 

SNOW FALLING ON CEDARS 
Directed by Scott Hicks; written by Ron Bass and Mr. Hicks, based on the novel by David Guterson; director of photography, Robert Rchardson; edited by Hank Corwin; music by James Newton Howard; production designer, Jeannine Oppewall; produced by Kathleen Kennedy, Frank Marshall, Harry J. Ufland and Mr. Bass; released by Universal Pictures. Running time: 130 minutes. This film is rated PG-13. 

WITH: Ethan Hawke (Ishmael Chambers), James Cromwell (Judge Fielding), Richard Jenkins (Sheriff Art Moran), James Rebhorn (Alvin Hooks), Sam Shepard (Arthur Chambers), Max von Sydow (Nels Gudmundsson), Youki Kudoh (Hatsue Miyamoto) and Rick Yune (Kazuo Miyamoto). "
67,You've Got Mail,"When Meg Ryan's character gets the sniffles and retreats from the world in ''You've Got Mail,'' she puts on pajamas and curls up in bed with her trusty laptop or a favorite book. Someday, when this cozy romantic comedy becomes a videocassette, it too will be a comfort object perfect for such moments.

Ms. Ryan, Tom Hanks and the archly funny Nora Ephron join forces, this time much more easily than they did in ''Sleepless in Seattle,'' to make an inviting love story that entangles a man, a woman, a couple of computers and a New York neighborhood so picturesquely idealized that it feels like Paris. Even if you already live on the Upper West Side, you might feel the urge to move there before the film is over.

The essence of that place, its populace and this precise moment in our technological evolution are captured so endearingly here that ''You've Got Mail'' becomes a New York story reminiscent of early Woody Allen romances, turning the characters into charmingly neurotic products of the place they call home. And in this setting, as far as ''You've Got Mail'' is concerned, the most important landmarks are intimate little hangouts and good old-fashioned books.

Being firmly on the side of the angels, this film treasures the written word so proudly that the closing credits thank a long list of publishing houses. And they really ought to be thanking Ms. Ephron in return. The film's mix of romance and reading matter is seductive in its own right, providing comfy book-lined settings and people who are what they read and write. When they fall in love, they do it wistfully, as if not quite believing that real life can measure up to really good fiction.

The most important literary outpourings here are those exchanged through E-mail, which makes the film that much more amusingly attuned to its time. The screenplay by Ms. Ephron and her sister, Delia Ephron, adapts Ernst Lubitsch's 1940 delight, ''The Shop Around the Corner,'' to the E-mail age with gratifying ingenuity and with its share of extra observations about how times have changed. The star-crossed correspondents, who in Lubitsch's film were employees of the same amazingly gracious retail establishment, have been promoted to people who run their own businesses. That makes their stress and loneliness all the more real, to the point where it's easy to see what drives Joe Fox (Mr. Hanks) and Kathleen Kelly (Ms. Ryan) into the world of cyberflirtation.

By making Kathleen the second-generation owner of a sweet little bookstore for children (titles on the shelves have clearly been chosen with loving care) and Joe the tycoon whose megastore may stomp her out of business, the film gives an additional shrewd angle to its foolproof old story.

It seems that Kathleen and Joe loathe each other in person but are unwittingly close confidants, electronically sharing their innermost thoughts. Should this sound merely like a lot of typing, Ms. Ephron finds plenty of ways to put laptops in bed and otherwise make E-mail visually interesting, starting with a nifty credit sequence that turns all New York into the environment for a video game. In addition, she makes time for shots at the big bookstore as a place that sells ''cheap books and legal addictive stimulants,'' in the wry words of Mr. Hanks's Joe. That's about as nasty as Joe needs to be under feel-good circumstances like these.

The film wafts through its urban paradise, a litter-free place full of flowers and friendly passers-by, as it watches Kathleen and Joe warily circling each other. Complicating matters are a few too many supporting characters, though many of these get the screenplay's best lines. (Says Jean Stapleton, as a genteel older friend of Kathleen's, about an old flame: ''It wasn't meant to be. He ran Spain.'')

But the film nicely incorporates its minor figures into its sociological milieu, like the two little children who are among Joe's next of kin. ''Matt is my father's son,'' he explains. ''Annabel is my grandfather's daughter. We are'' pause ''an American family.'' Dabney Coleman and John Randolph play the much-married fathers, and at one point three generations of lonely male Foxes find themselves luxuriously ensconced on family boats at the 79th Street Boat Basin.

Ms. Ryan plays her role blithely and credibly this time, with an air of freshness, a minimum of cute fidgeting and a lot of fond chemistry with Mr. Hanks. And he continues to amaze. Once again, he fully inhabits a new role without any obvious actorly behavior, to the point where comparisons to James Stewart (who starred with Margaret Sullavan in the Lubitsch film) really cannot be avoided.

Though he has none of Mr. Stewart's lanky grace or leading-man patina, the wonderful Mr. Hanks has all the same romantic wistfulness and the same poignant shyness when he learns who Kathleen really is. He shares Mr. Stewart's lovely way of speaking from the heart. Mr. Hanks also makes fine use of the film's comic opportunities, as in a scene that has him explaining how ''The Godfather'' resembles the I Ching as a guide to life. ''What should I take on vacation?'' he asks rhetorically. Advice from ''The Godfather'' on this question goes this way: ''Leave the gun, take the cannoli.''

In a film that makes Kathleen's sensibility clear by having her quote Joni Mitchell, the principals' erstwhile mates are part of the trenchant local color. Parker Posey plays Joe's girlfriend, a piranha from the publishing world (''Patricia makes coffee nervous,'' Joe remarks), and Greg Kinnear plays a writer for The New York Observer prone to stupefying pronouncements. These characters are as apt a part of the scenery as Dan Davis's warm, audience-friendly production design.

''You've Got Mail'' deserves to trigger a revived interest in the late honey-voiced singer Harry Nilsson, whose music on the lighthearted soundtrack provides just the right mix of jauntiness and yearning. Mr. Nilsson's beautiful music hasn't figured this prominently in a film since it turned up in ''Midnight Cowboy,'' used to quite different effect. 
''You've Got Mail'' is rated PG (Parental guidance suggested). It includes mild profanity and tender clinches. 

YOU'VE GOT MAIL 

Directed by Nora Ephron; written by Nora Ephron and Delia Ephron, based on the Ernst Lubitsch comedy ''The Shop Around the Corner,'' written by Samson Raphaelson from the play ''Parfumerie'' by Miklos Laszlo; director of photography, John Lindley; edited by Richard Marks; music by George Fenton; production designer, Dan Davis; produced by Lauren Shuler Donner and Nora Ephron; released by Warner Brothers. Running time: 110 minutes. This film is rated PG. 

WITH: Tom Hanks (Joe Fox), Meg Ryan (Kathleen Kelly), Parker Posey (Patricia Eden), Jean Stapleton (Birdie), Dave Chappelle (Kevin Scanlon), Steve Zahn (George Pappas), Greg Kinnear (Frank Navasky), Dabney Coleman (Joe's father) and John Randolph (Joe's grandfather). "
